Seat Type,Route,Type of Traveller,Date flown,Reccomend,Comfort rating,Comment
Economy Class,Dubai to London Heathrow,Solo Leisure,December 2017,0.0,0.0,"✅ Trip Verified | Flew British Airways from Dubai to London Heathrow. Overnight flight that departed on time and arrived 25 minutes early to a very easy to navigate through T5. Unfortunately this was the only positive aspect of my flight. Flight was on board a very old 744 with very poor inflight entertainment. B747 are beautiful old planes but the interiors should be updated. The food was OK. The biggest disappointment was the cabin crew who all seemed miserable and not interested. No smiles or even a ""welcome on board"" whilst walking down the aisle. On arrival they were standing together talking and laughing and not even acknowledging any of the passengers. The service provided by BA has significantly declined over the past few years. Even the newer planes (B777 and B787) haven't got cabins that compete with todays market. Also, just like other budget airlines, you now have to pay to choose your seat. Very very disappointed that I didn't choose another carrier as there are loads to choose from on this route roughly for the same price."
Economy Class,New York to Budapest via London,Solo Leisure,December 2017,0.0,,"✅ Trip Verified | I was on a flight from New York JFK - Budapest via London Heathrow on 9th December The flight was delayed 6hrs, when I arrived to London I got information that my flight to Budapest was cancelled due to heavy snow. That was on the 10th December. I was there with a few thousends other passengers from BA, nobody gave us any food, any water and the most important any information as to what we should do with our transfers flight and suitcase. After waiting 2-3 hrs for my suitcase I was struggling with cold at terminal 4. Someon from BA took us to terminal 5. Today is 12th December and I am still in London without any information about my baggage and transfer flight to Budapest. I paid myself for a  hotel and taxi because all other hotels BA offered are fully booked. This is not what you normally expect from British national carrier airlines. Very poor website, nothing is working and for 3 days no call centre, they try to tranfer you from one number to another without any sense."
Economy Class,Tokyo Narita to London Heathrow,Solo Leisure,December 2017,0.0,,"✅ Trip Verified | Flew Tokyo Narita to London Heathrow with British Airways. Flight delayed by four hours - which is understandable due to the weather in the UK at the time. The inflight entertainment was awful. It was good for only a short haul journey. Very limited selection and very dated equipment/screens. Plus they kept stalling. The staff were ok, although a few seemed allergic to smiling and seemed glum. We were fed at the beginning of the journey and then not until an hour towards the end. The food was average and I was very hungry throughout the service. As far as I am aware, on a long haul flight especially the services are to help you feel as comfortable as possible - I don’t call being starved very comfortable! Other airlines offer snacks throughout the journey. Why can’t you? You used to be the best and now you’re budget. I won’t be flying with British Airways again. "
Economy Class,Hamburg to London Heathrow,Couple Leisure,June 2017,0.0,,"✅ Trip Verified | I was quite disappointed with my experience with British Airways. First of all, our flight was two hours late which made me miss my connecting flight in LHR. However, the crew on the ground handled the situation quite well and provided all passengers with food-vouchers and even the captain came out of the plane to explain the situation. However, there was no information on connecting flights in LHR. Once on the plane, the lack of free service during the flight was a big minus as it now really does not make a big difference if you are flying Ryanair or British Airways. Seats were okay but nothing outstanding - same with the crew."
Economy Class,London to Pisa,Family Leisure,October 2017,0.0,,"✅ Trip Verified | Flew British Airways to Pisa due to flight times and BA miles. Overall a poor economy class product. The seats were really tight. Staff were ok, but seemed stressed. You had to pay for food in economy which is new norm of BA and they predict other airlines will follow suit. Difficult to get a glass of water. Three requests and then it materialised and that too for a young child. At check-in their automated system failed so it was done manually - thank goodness for carbon units still employed by BA. Overall BA is dramatically failing. Those who have BA miles will exhaust them and shift to other airlines. BA is no longer UK's national airline. The magic of Alex Cruz and Willie Walsh is not working if it ever did. Avoid if you are paying up front rfor your tickets. Loyalty does not pay."
Economy Class,London to Toulouse,Family Leisure,October 2017,0.0,,✅ Trip Verified |  London to Toulouse. British Airways is no longer a full service airline. To compete with EasyJet and Ryan Air it has removed food and drink from economy class and replaced with M&S food. This is over-priced and not that great. Secondly the food was never complementary- it was included in your ticket price. This was the case in this flight to Toulouse. Next time go to Pret and get a meal from there and carry it on board. I asked for a glass of water. This came in the last 30 minutes of the flight once the trolley had gone down the aisle. At least offer people water - it is a human right. The seats too are tight and a rear toilet in economy has been removed to maximise profits. In this flight there was no spare tissue or toilet roll.  I was told by the cabin crew when I asked about the new service level that more may be in store for BA's comers - charging for food in economy class for long haul flights. I hope that this is not true. The only saving grace is a comprehensive network and flight times are good. Customer care and service has gone. Avoid BA if you can. Consume your BA miles and shift to other full service carriers. They are better and more responsive.
Business Class,London to Santiago,Solo Leisure,November 2017,1.0,,"✅ Trip Verified | Great flight out from London to Santiago. Lovely, friendly crew. Goats cheese salad to start, fish pie for main, good selection of wines and managed 7 hrs sleep on way out and even longer coming back! 787-900 is a fantastic aircraft even if you do have to climb over some feet to get out, the window seats are very private. Flying this aircraft to Seychelles in May and really looking forward to it. Just waiting to try the new bedding now and catering. Just flown out to KUL and BA are way ahead of MH."
Economy Class,London to Rome,Couple Leisure,November 2017,1.0,,"✅ Trip Verified |  London to Rome. It's been a while since I last flew on BA and it certainly has changed. While the terminal, staff, aircraft, and seats are of the same high standards as before - the free in-flight meals and beverages have disappeared and must now be purchased. It seems that BA is slowly morphing into a low-cost carrier at least as far as European destinations are concerned. Presumably, this is due to the competition from Easyjet and Ryanair as well as it's CEO hailing from Vueling. I suppose it's only fair given that the fare was as cheap as the other two and BA flies out of LHR."
Economy Class,London to Manchester,Solo Leisure,November 2017,1.0,,"✅ Trip Verified |  London to Manchester. Hard to complain about a flight which last 35 mins but I was hoping for a bacon sandwich to keep me going after coming off a long haul flight with a short connection. This flight used to include complimentary tea/bacon sandwich until the much criticized move to M&S inflight offerings and a hot sandwich isn't available anymore. All things considered, that is understandable."
Premium Economy,London to Seattle,Solo Leisure,November 2017,1.0,,"✅ Trip Verified |  London to Seattle, a seamless flight which was on time and little to complain about. Efficient and professional service, meal service fine, good comfort and additional space in premium economy worth the extra. IFE selection was perhaps a little limited. Bags slow to arrive at Seattle but don't put that on BA."
Premium Economy,Seattle to London,Solo Leisure,November 2017,1.0,,"✅ Trip Verified |  Seattle to London. Good experience all round and nothing much to complain about. FA's efficient and friendly, flight was on time. Meal quality was average. Overall, believe the extra amount for premium economy worthwhile although I had cashed in some miles to cover the upgrade so perhaps a false economy. Major complaint is BA's policy of charging to book a seat - it's extremely irritating and stressful, especially in premium economy upwards."
Economy Class,London to Barcelona,Family Leisure,June 2017,0.0,,"✅ Trip Verified |  London to Barcelona. The ground service was really poor even thought I used premium counter (Sapphire status of OW).  I paid 22 pounds to get exit for myself and my mom, however the staff in the counter keep question if my mom can speak English. Staff could not distinguish the Taiwan passport from the China passport and keep said that we need Visa to go to Spain. It took nearly 10 min for her to confirm with her manager and her attitude was really really bad. The worst staff I had  met. Although BA sold a very expensive ticket, however, even a cup of water you have to pay for it. I would never choose this airline again."
Economy Class,Vancouver to Edinburgh via London,Business,December 2017,0.0,,"✅ Trip Verified |  Vancouver to Edinburgh via London was the worst travel experience I have had. I was travelling with 2 seniors (+85 & +70) we requested assistance and nobody showed up at any of the gates neither departing nor arriving. We actually had to beg for help. The distance between gates is far and too much walking for seniors. In our way from London to Edinburgh it was a nightmare. The flight was delayed and we got to London about an hour late, on top of that we asked for assistance to take the 2 seniors to the next gate and no one seemed to care. The 2 seniors had to walk all that way. It was not only the walking, it was the rush they had, as we had to go trough immigration and the next flight was living in less than 1:30 hours. On our way back from Inverness to Canada another nightmare despite we requested assistance in advance. Once again there was nobody waiting for the seniors at the gate. Again we had to beg for assistance and the British Airways staff did not seem to know or care about this. They said that they called the buggy and that was all. We said that we were going to miss the airplane as the gates/ terminal distance were far and no one seemed to care at all. We were lucky I asked a gentleman who was driving one of the buggy and passed by and he kindly accept to take the seniors to take the bus area from terminal 5 to 3 (in London) and then arranged for them to be picked up in terminal 3 and after security point. This gentleman who is not British Airways employee provided a great service. Summarizing the only good experience we had was with an external person that just by chance I asked and he decided to help us out. Seats were another problem. We did the online check in (24 before) and we had the seats already chosen 12D for one senior (isle) and 18D (isle) for the other senior. When we got to the counter in Inverness Airport the agent told us there were not seat chose even though we had prove and the boarding who was sent by email showing the seats. Then the agent put the seniors almost at the end of the airplane and in the middle seats. So once again, more walking for them, problems to get in/out the seats, and of course problem to get to the washroom. - luggage another problem! British Airways in Inverness said that the luggage goes directly to Victoria and that we did not have to pick it up in Vancouver. Surprise surprise! We went through customs and when we got to Westjet counter for the connection to Victoria they asked for the luggage.  They said we had to pick it up before going through customs. There was no way to go back to the carousel, so we had to wait for the Westjet staff to contact somebody from British Airways to get us to the carrusel and take the luggage. So nightmare again!! And another rush to us to get to the next fligh. According to Westhet agents they said that British airways should have had the assistance for the seniors and of course pick the luggage with them and bring it to the connection. What can you expect from British Airways? If It doesn’t even care about the passengers that are seniors and requested assistance. We can only thank Westjet staff who provide the assistance in Vancouver."
First Class,London to Berlin Tegel,Solo Leisure,November 2017,0.0,,"✅ Trip Verified | London to Berlin Tegel return. It's becoming ever more difficult to notice any difference between British Airways and the budget airlines. The only saving grace is that I've never experienced any issues flying out of or into T5. Noticeable cost cutting measures include the removal of complimentary onboard food and drink but also, BA have removed a toilet in economy within their A319 fleet to make space for seats in row 24 and 25 meaning there is only one economy toilet, disgraceful. My flight to Berlin was busy and the line for the sole toilet existed throughout the duration of the flight meaning the flight attendants couldn't offer an efficient trolley service and involved a continual display of other passengers weaving in and out of aisle seats. I feel for the staff who often work tirelessly. "
First Class,London Heathrow to Dubai,Family Leisure,November 2017,0.0,,"✅ Trip Verified | Flew London Heathrow to Dubai. Arrived at the new ""Wing"" at T5. A quick process and into the Concorde lounge. I noticed (as before) the check in staff do not mention the Concorde lounge per se. ""Just straight through there sir and into the 1st class lounge."" This option was rammed. Am pleased to confirm that the Concorde lounge has had a long overdue make-over. It looks a bit better. Had a snack and a few glasses of fizz - then made my way to terminal B. Friendly FA showed me and wife to our seats. Looked freshly cleaned. Pushed back on time. 1st Class was full. Airborne I had dinner: Mezze to start which was nice. Some chicken thingy for mains - which was horrible. Cheese and biscuits to conclude. Wines were ok. The seat (the new ""First"") - is not wearing well. Looking somewhat tired. Managed to get some sleep on the ""bed"" with the usual duvet and blankets. I am a tall guy and need the space. the Club World option is horrendous. Very pleased to confirm that Mr Alex Cruz (BAs CEO) has re-introduced flowers in the 1st WC. Readers will recall he cancelled these last year to save costs. If Mr Cruz wants to save costs he should get rid of the gas guzzlers 747-400s. So a full 1st cabin will generate about £40,000 of revenue. The flowers (for 2 WCs) probably cost £8.00 - so, pleased to see the airline is still flying and not gone bankrupt over the re-introduction of eight quids worth of flowers per flight. The 1st product is very mediocre compared with say Emirates. Some have said its ""sort of an upmarket Business class"". I'd agree with that. One would think, BA would want to make a big impression on this route - with at least some high end food. ""Logic"" is not something BA seem to understand - given the high level of negative reviews on this site. Very disappointing."
First Class,Dubai to London Heathrow,Family Leisure,November 2017,0.0,,"✅ Trip Verified | Flew British Airways from Dubai to London Heathrow. Arrived at Dubai airport, checked in - and endured horrendous security. Not BAs fault. Walked miles to the ""new"" lounge. It's a weird set up. You walk through the Club option, with a considerable variation of food - to a tiny room with small options of food. Seating very mediocre. Made our way to the plane. Departed bang on time. Airbourne I went for lunch straight away - after a couple of G&Ts. Arabic lamb starter. Boring and tasteless. No other options. Skipped the soup. Had a salad. The beef mains was very good - not exceptional and no wow factor. Just nice. Red wine was OK - mid priced stuff at about £25 a bottle. My wife was told the beef was now ""unavailable"". My friend had beef and so did I - when challenged on this I was told - only 3 beefs aboard! This flight was again full and had been for weeks. 14 people. 3 beefs. A joke. My wife had an Arab dish which she did not like. When it came to coffee, my friend, then I - had a choice of chocolates. My wife then had the box offered - only to have it more or less demanded back by a pushy FA. Most BA cabin staff are good - this one was a PR disaster. Flight was smooth all the way home. Another sad experience from our national carrier. Definitely not worth some of the extreme prices posted for this route."
Business Class,Saint Lucia to London Gatwick,Business,November 2017,0.0,,✅ Trip Verified | Flew British Airways from Saint Lucia to London Gatwick. Agree with other recent reviews: BA quality is severely lacking compared to other Oneworld carrier’s business class. We were not addressed by name. Staff seemed rushed and not proactive at all: had to ask for anything we required. Not all breakfast items were available. Seat space and comfort seriously under par. Nobody came to collect rubbish prior to landing so it remained on the floor in front of me. Did not feel like valued customers.
Business Class,London Heathrow to Belfast,Business,November 2017,1.0,,✅ Trip Verified | Flew from London Heathrow to Belfast George Best Airport on BA1414. Boarding was well controlled and the breakfast food served onboard was very good. I was also impressed by the fast and efficient service. Arrived in Belfast ahead of schedule time. Overall very good flight and service.
Economy Class,London to Miami,Solo Leisure,November 2017,0.0,,"✅ Trip Verified |  London to Miami. British Airways have been so disappointing and need to improve fast. They cancelled a flight the morning of a flight and so I had to buy a new flight. The compensation they offered  was £22. Then my most recent trip was to Miami which I had an expired ESTA but instead of letting me know they could put me on flight for a small fee they let me buy a £1000 new flight. Then offered me a £112 refund when I phoned to complain. I am a BA member and must say the customer service is atrocious, as a company it’s just spiralling down."
Business Class,London Heathrow to New York JFK,Couple Leisure,November 2017,1.0,,"✅ Trip Verified | Flew London Heathrow to New York JFK. Have flown this route a number of times with British Airways, but this was my first experience with the new Club World offerings (White Company bedding, improved catering, refurbished 747 club world cabin). The new improvements are excellent, particularly the catering. Both the presentation and the taste of the new food is a significant step above the previous Club World catering offering and the new ‘pick your starter and desert’ options from the display trolley is a real nice touch. The new bedding makes the Club World bed much more comfortable to sleep on."
Economy Class,Berlin to London City,Business,September 2017,0.0,,"✅ Trip Verified | Berlin to London City. I have never experienced such an unreliable, unprofessional airline, that is so hard to contact. My flight kept being delayed for hours. After more than 4 hours delay, there was no point for me to fly to London anymore, as I had missed an important meeting. I was told that I will get my flight price refunded and also get a compensation. After a few days I call their customer support to ask about the refund. They told me that I will get the refund within 7 days. After 4 weeks, I notice that they still haven't refunded me. It's very difficult to contact them. The phone hotline is only available until 5pm (Monday-Friday). They hide the contact form somewhere deep in their website. Once I managed to send them a message, I only get a reply a few days later telling me, that they can't reply to this case via email and that I should call. All I want at this point is to get my deserved flight price refund. I take an hour off my work to be able to call in their short opening times. After being on hold for a while, it turns out, they made a mistake and will refund me the ticket within the next 48 hours. A very convenient mistake, to forget a 360€ refund and not be able to look into this via an email inquiry. Only after I asked what compensation I will get for this, I was offered 5000 Avios points. No thanks, with that level of unreliability and bad customer service, I will make sure to never fly British Airways again. I make sure to tell all my friends about this experience."
Economy Class,Funchal to London Gatwick,Solo Leisure,November 2017,1.0,,"✅ Trip Verified | Flew Funchal to London Gatwick. Just wanted to thank the staff on the aircraft for retrieving my game console, was a pleasure to fly with a great airline like British Airways. I left my console on the flight, once I realised that I have left it behind I headed over to the help desk which is located in the baggage control area. The staff were friendly and happy to assist me, the gentlemen made a call and while this was happening the air hostess appeared with my console in hand. This has really made me appreciate flying with a high quality airline. Future flights to Madeira are most certainly going to be with British Airways."
Business Class,Newcastle to San Francisco via London Heathrow,Couple Leisure,August 2017,0.0,,"✅ Trip Verified | Flew Newcastle to San Francisco via London Heathrow with British Airways. One issue after another! The flight from Newcastle boarded early but due to weather conditions in London, we departed late. We should have had a two hour lay-over for our connecting flight but arrived only thirty minutes prior to departure to San Francisco and were told at disembarkation that we had been re-routed via Washington! Our booked flight to San Francisco also departed late and we sat in the lounge watching it push back. We finally got on the Washington bound aircraft but were again delayed in order to allow late arriving passengers from Amsterdam to catch the flight. The delay meant that the late departure was then caught up in a computer problem at Heathrow thus delaying the flight further. We eventually arrived in Washington twenty minutes before the next connecting flight - there was an announcement over the tannoy system for us to hurry up but no physical help available. Obviously we missed the flight and spent the next hour (around about 23.00) trying to find help at the check-in desk in a practically empty airport. United (acting on behalf of BA) checked us onto a flight the following morning and the BA staff eventually found us a hotel room thirty minutes drive away. Ironically, the BA personnel had been busy ensuring the the passengers from Amsterdam that had caused the late departure made their connecting flight and were therefore not available to help us! We were also downgraded to economy on the flight between Washington and San Francisco as business class was full. We eventually got to San Francisco about 22 hours after our scheduled arrival. BA offered no compensation for either the time lost or the down-grade in class. They did pay for the taxi from the hotel and the cost of the pre-booked (but unused) hotel in San Francisco. The airline blamed everything on circumstances and would not accept any responsibility. Not a good experience at all and nobody really cares!"
Business Class,Manchester to London,Couple Leisure,October 2017,0.0,,"✅ Trip Verified | Manchester to London. We were flying business class and expected a fast track boarding, but alas the fast track boarding queue was longer than normal boarding queue! Then on the flight it was the case of 2 ends of the plane on either side of the curtain, those in the front were offered a quick sandwich and a drink those behind had to purchase. The short flight was on time, the leg room in front of the plane was exactly same as at the rear except the middle seat was blocked off! Though it felt like business class in the plane, on the ground pre boarding it certainly did not! BA needs to improve and fast?"
Economy Class,London to Athens,Family Leisure,November 2017,0.0,,"✅ Trip Verified |  London to Athens. On the date of the flight I received a text message and an email saying my flight is full so I could check in my carry on luggage for free, later on another text saying that I will have 46 minute delay. I was at the airport almost 3 plus hours before. Checked in at the machines but It couldn't allocate my seat number. Then a British airways assistant came and successfully gave me my boarding pass with my seat number. Seating at a cafe I was checking the tv screen every 5-10 minutes and it said delay 12:46. My flight was scheduled for 12:00. At 11:45 I tried to pass through security but the machine would allow me to scan my boarding pass and asked me to seek assistance. The security officer told me that I lost the flight because my flight was at 12:00 and suggested me to go to counter C1. Now at the counter C1 a lady told me that the flight was at 12:00 and I lost it. While I was explaining that the flight will be delayed she made phone calls and tried to explain the whole situation. Then she told me to go through security because the bar code on my boarding pass will be valid for 2 minutes! Went straight to my exit and it was packed from people sitting. Waited at the gate for another almost hour and in total the delay on arrival to Athens was 1hr 20mins."
