Seat Type,Route,Type of Traveller,Date flown,Reccomend,Comfort rating,Comment
Economy Class,Berlin Tegel to London Heathrow,Business,November 2017,0.0,,"✅ Trip Verified | Very disappointing. I was scheduled on a British Airways flight to connect to a long haul flight at Heathrow and having flown BA in the past it was very sad to see how BA service went down this year. Meal and drinks for purchase, uninspired staff and delay on inbound flight. I would fly a low cost carrier instead, since that's exactly what BA now achieves. Many years ago it was one of the european flagship carriers and it was fun to fly BA, now it's just another shrinking violet."
Business Class,London Heathrow to Doha,Couple Leisure,October 2017,0.0,,"✅ Trip Verified | This was really a no frills business class. This flight was part of trip with Qatar Airways. Unfortunately, the London to Doha was operated by British Airways. The seat is cramped and really outdated compared to the other major airlines. The IFE was really poor with old screen system and poor range of options. The meal was not good related to the price you have to pay. The FAs were really dull, nothing wrong but no effort to communicate with passengers like FAs from other airlines. BA really need to refresh or renovate their business class cabin. It might be excellent innovation back in mid 2000s but the industry has moved on."
Economy Class,Singapore to Sydney,Couple Leisure,November 2017,0.0,,"✅ Trip Verified | British Airways is seriously lacking in all areas. Singapore to Sydney return in economy. Fly the route often, usually with Qantas which are great. The flight out to Sydney is only 7.5 hours and over night - most people are looking to maximise their sleep. Especially those who have come from London. Cabin crew were surly, unhelpful and seemed rushed and disorganised. After departure they took almost three hours to get the dinner service over and done with and turn off the lights so people could get some rest. During the flight cabin crew chatted loudly and seemed unaware that people may actually want to rest and get some sleep. The food is very average also. Two hours before landing, they serve a pre landing breakfast snack of a sandwich wrapped in plastic. No tea or coffee. The competition is too strong for this route. I would never use them again."
Economy Class,London Heathrow to Basel,Business,November 2017,0.0,,"✅ Trip Verified |  London Heathrow to Basel. Boarding: There are now so many 'priority boarding' passengers that all those who do not fall into this category are left to feel like second-class citizens. (The new numbering system is likely to cement this impression further.) Since I was traveling on a 'low-price' ticket, I found myself seated right at the back of the airplane. Yes, BA appears intent on replicating England's class system!  On board there was a delay of 40 minutes due to a French ATC strike. Obviously, this was not BA's fault, but no drinks, not even water was offered during the wait on the tarmac. After take off, the drinks trolley moved painfully slowly down the cabin. Why BA offer heated sandwiches, further slowing down their BOB service even further, when only two ec cabin crew are serving in the first place, is beyond me. The no-cash policy further contributes to the snail-pace progress of the trolley. The trolley (and a cup of tea) was within grasping distance as the captain announced we would be landing in ten minutes. End of service. Someone at the back quipped, 'So you opted for the premium seats, too!' Yes, BA is a joke, its attitude towards passengers (its customers) shameless and embarrassing. It wasn't until I had left the airport that I was able to get that cup of tea. Needless to say, Eurowings and EasyJet do things much better."
Economy Class,Miami to London Heathrow,Couple Leisure,November 2017,0.0,,"✅ Trip Verified |  Miami to London Heathrow. A bit of a mixed bag. Boarding at Miami was conducted efficiently and the flight departed on time, albeit that some passengers were still getting into their seats as the aircraft was pushed back! So much for safety. Seat would not remain in the upright position resulting in an uncomfortable flight and subsequent aching back on arrival at Heathrow. Also my wife’s IFE failed mid flight. Impossible to hear information from the flight deck. These ageing 747’s really are in desperate need of replacement. The congealed chicken curry was disgusting and unpalatable, the alternative pasta dish was deemed acceptable. The minimal breakfast offering leaves a lot to be desired. The only redeeming feature was the excellent service provided by the young enthusiastic cabin crew. They must feel very demoralised given the poor quality product they have to support. Flight arrived early and luggage was delivered promptly."
Business Class,Prague to Washington via London,Business,November 2017,0.0,,"✅ Trip Verified |  Prague to Washington via London. British Airways has turned out to be the worst airline I have flown. Unfortunately I am forced to fly them often from PRG, if I want to connect on their One World partner AA, which I have Exec Plat status with. BA charges for everything, including water. PRG-LHR is on a small business class seat (same as in economy), dried up breakfast that was tasteless, flight attendants that could not care less and when I asked for coffee told me they were landing soon (40 mins before landing) and that I should have thought of it earlier. London to Washington  was on a broken down 747, seat sofa which you are supposed to lie on broke down and caved in on the floor. Had to be moved twice before they found functioning seat. Food was dried up beef with red that gave me a headache after two sips. Entertainment system has about 40 movies, compared to about 200 options on AA flights. Overall horrible experience. The extra added costs for flying over LHR and paying extra  tax is ridiculous. BA, what is it about your flights PRG-LHR, with your onboard luggage allowance only? They charge USD 100 for a checked in luggage even to Emerald partners?  Horrible food, aircraft, LHR and transfer experience. Good luck BA, will avoid at all costs. Included a picture from the bathroom which was broken."
First Class,Cape Town to London,Couple Leisure,November 2017,1.0,,"✅ Trip Verified |  Cape Town to London. I can report a positive experience on our flight. From the moment we boarded, cabin crew were polite and efficient, and provided a high-class service throughout. Seats 4E/F suffer a bit from poor storage space and a lack of privacy, but they are the best for a couple. Glasses were kept topped-up even before take-off. The menu provided four choices of both starter and mains, and all the dishes were both well-presented and well-cooked. Talking to cabin crew, it seems that staff are now being trained to prepare and present food with greater care, and this really showed on the flight. The IFE screen was the usual low resolution with a limited selection of films. Still no WiFi, of course. Take-off and landing was on schedule, and announcements from the cockpit had that typical air of friendly professionalism. An excellent flight, overall."
Premium Economy,Bangkok to London Heathrow,Business,September 2017,0.0,,"✅ Trip Verified |  Bangkok to London Heathrow. Despite all the negative reviews I decided to fly with BA on my recent trip to Europe, on this route BA has a daylight flight (I can't stand midnight plus departure and night flight where you can't sleep anyway and arrive at your destination wasted), more luggage allowance in premium economy and they advertised what seemed to be a comfortable cabin and stylish service. The fare was also pretty good. In the end, I have to admit my mates were right, this was a let down all along. My issues were the following. I purchased a ticket in premium economy. The advertised seats on the BA Thailand website were reflecting the newer version, when in fact not one of the 777-200 which operates the LHR-BKK-LHR route have been refitted. The seat date from the early 2000's - almost two decades ago, and I had to pay 35 pounds each way to select my seat. Come on ! Yes I got my amenities kit, a better pillow British papers and pre-departures drinks, a full bar and plenty of drinks to keep me going for 12hr plus. But the seat is old, not that comfy, the IFE belongs to the late 90's and is a disgrace to the industry. Great sound, good headset but rubbish tiny screen with a poor picture quality. I spent 12hr looking at the ceiling as I could not see squat. The seat itself is way outdated and the cabin/seat were dirty. It was however A bit better out of LHR but still not that great. The meal service was not good out of BKK. Bar service did not have peanuts or savory snack - just a napkin. Main dish was ok, but appetizer and dessert a cheap joke. No cheese nor crackers. Not enough at all, you are left starving, and in economy it is even worst. I have to say it was better on the return leg and will give you more details in a bit. Cabin crew told me they just reverted to the old style as they have had way too many complaints and the J/C had a brand new a la carte service as well.  Cabin crew operating both legs were great - professional, approachable and present in the cabin every 30mins with drinks. Out of LHR the main meal was this time pretty good, including cheese and crackers and a much better appetizer plus desert. The only false note was the meal pre-selection. You get served first as they do with special meals - but do not offer you any drinks. You have to wait for a very long time. By then my meal was cold and i sent it back. They did replace it right away, but this was clearly a waste of time. Pre-selecting your meal, means you are sure to get your choice of casserole and that you wish to be served at the same time then others so the bar is right behind and one can enjoy a glass of red with is steak. Pax with Special meals service can wait as the crew have way more to hand out and these veggies lovers often do not drink anyway. Other than that it was this time a decent meal. Having said that, there was no middle service, which meant 9 h between lunch and breakfast without even a snack. Not acceptable on such a long haul. Funny enough the BKK-LHR feature three meals so why not on the LHR-BKK leg ?. BA could be so much better. They have a great force but way too many cost cutting left and right - and should have upgraded all their fleet at least 5 years ago. It is clear to me the CEO is running BA to the ground and needs to get the sack by share holders sooner rather than later ."
Economy Class,London Gatwick to Verona,Solo Leisure,October 2017,0.0,,"✅ Trip Verified | After 3 hour delay at airport, flight destined for Verona with arrival time of 21.35, was rerouted to Venice, meaning bus transfer and arrival at 2.30am. We passsengers were informed minutes before boarding plane of this change. I had planned to stay the night with a friend who was going to pick me up at the airport. At such an unsociable hour of the morning, I could no longer disturb her. I explained all this to BA, who advised me that a rep would help me find a hotel and I would be reimbursed. On arrival, I was brusquely told by a BA rep to go online and find my own accommodation. After a more than 5 hour delay, my phone had no battery life. I was left to borrow a fellow passenger's phone and search for the cheapest motel near the airport - miles away from where I should have been. It transpires BA knew there had been technical problems in the morning of the flight - yet sent passengers an email urging us to get to the airport even earlier. I wasted 5 hours at Gatwick (when I could have carried on working). Also had I known, would have tried to get on an earlier flight or postpone our journey. To top it all, when all 150 passengers finally arrived at the deserted airport of Verona at 2.30 am - no taxis. BA had not thought of contacting local taxis informing them of a queue of tired clients. Further wait. Not only had I missed my dinner reunion, to my astonishment British Airways has refused to reimburse my hotel bill, stating that they had after all got me to my destination. I hadn't even counted the extra taxi bills I incurred (£45) - but I did expect BA to reimburse the 50€ hotel as a goodwill gesture. Not impressed."
Economy Class,Madrid to London Heathrow,Business,September 2017,0.0,,"✅ Trip Verified | Flew British Airways from Madrid to London Heathrow. An aircraft full of people. We were being asked to check-in our hand luggage or, in some cases, to leave it by the aircraft and pick it up upon arrival. I must say I find this irritating, as I had one piece of luggage, within the rules. Other people didn't. Those should be asked to do this. I truly felt as if I were in a low cost airline, which is sad to see. Short-haul with BA never again!"
First Class,Tel Aviv to London,Solo Leisure,November 2017,1.0,,"✅ Trip Verified |  Tel Aviv to London. We arrived at the airport with a lot of time due to the stories of how long security can take. The stories were true, although it is actually a very efficient and well organised airport, they just have very thorough border and immigration services as well as all passengers face enhanced security scanning of hand luggage etc. There were limited priority options available for First Class passengers, although I suspect that is more down to the airport than British Airways. The lounge provided is a third party one and is the same for business and first, and isn’t really acceptable. If it was just business then it would be ‘fine I guess’ but there is not very much seating, the food offerings were almost non existent and drinks were limited. Even the main coffee machine was broken so there was another, very complicated, machine with all instructions only in Hebrew. At the gate there was the usual ‘priority boarding’ queue as well as the regular queue. But the priority queue included all first and club passengers as well as all Oneworld emerald, sapphire and ruby members - which is a lot of people! Whilst it is nice to offer a perk to all of those members, there really should be another queue for first and Oneworld emerald as the queue was quite long. The service on board didn’t start off very well for me as due to some confusion amongst the crew I got missed out when crew were offering drinks amenity kits etc, and after seeing every one was finished and the crew were all relaxing at the front I had to go to the galley and ask. They were very apologetic and provided excellent service for the rest of the flight but those kind of mistakes really shouldn’t happen in first. The seat is comfortable and offers a reasonable level of privacy and storage space. Annoyingly the ife has to be stowed for take off and landing, which limits how much you can watch. It was the Thales entertainment system so the quality was reasonable and with a fairly good selection of things to watch. The food and drinks on board were all excellent, including a delicious veal cheek main course and some wonderful wines that went together very well. Aside from the hiccup at the beginning, the whole experience on board felt very attentive and special. It would have been nice to have been referred to by name, which I have had before on BA and with other airlines, even in business class. On arrival the priority bags came out incredibly quickly and were on the belt before we got there, which was impressive as immigration had also been very quick. Overall this was a very nice flight with a solid product and excellent crew, let down only by the ground service in Israel. I used Avios and a companion voucher for this flight so it worked out excellent value for money."
Business Class,London to Tel Aviv,Solo Leisure,November 2017,1.0,,"✅ Trip Verified |  London to Tel Aviv. Arrived at Heathrow at about 5pm expecting it to be very busy, but check and security felt like it was 10pm, very easy and quick process (which included regular rather than fast track security as we didn’t follow the signs properly). We used galleries south lounge and first impressions were actually pretty poor, although they did later improve. The food offering on arrival was a few sandwiches, soup and some dry cake. This wasn’t really acceptable at all although about an hour after we arrived the evening meals were laid out and there was a good selection of hot and cold dishes which were quite tasty. Drinks overall were good as always with British Airways although champagne is only served on request and the quality of the one provided was really quite appalling. In terms of seating, there was enough for all the passengers in there, and it was quite busy, and due to it being broken up into different areas it felt like a nice place, although better variety in seating, including some more comfortable chairs, would be appreciated as well as a bit of modernising. This biggest failing was the staff in the lounge, which were more similar to staff in a factory canteen than what you find in competitors lounges. Smiles are free and go a long way, and whilst being unobtrusive can be a good quality, eerily walking around slightly like a zombie, seruptitiously clearing your table without any interaction whatsoever was just plain odd! The other area which I find completely below standard are the toilets. Whilst they are kept clean and there are some nice touches with flowers etc, the general standard of the toilet decor was more like a cheap gym locker room. The regular Heathrow airport toilets are far far nicer and to a higher quality. Whilst the individual toilet cubicles with self contained wash areas are nice, there aren’t really enough and some regular wash room facilities and urinals as well would make it easier. On board me and my friend had the centre two seats at the very back of the cabin. This meant that we basically had our own private suite as well as direct aisle access. These seats are fantastic when travelling with someone and as good as any business offering from any airline in terms of comfort, privacy and access. Unfortunately this was an ancient 777 with the old ife, which is a completely unacceptable product in terms of resolution, selection and even the fact that some screens won’t even stay in place and fold themselves away! British Airways need to have an active plan to refurbish or replace all of these aircraft, end of story! Even the Thales system is showing its age now, but this Rockwell Collins one makes vhs tapes look state of the art! The cabin crew were slightly mixed in terms of level of service and experience. Some were clearly not in sync with each other when serving drinks and meals etc, and some were rather abrupt and unfriendly. Others however were absolutely wonderful and made the whole flight a wonderful experience. Food and drinks on board were actually quite good, although the on board service was not the new club world one on this route yet. Overall it was a very enjoyable flight, and as I booked using Avios and a companion voucher it was exceptional value for money. Having said that, I would have still considered it good value even if paying cash."
Economy Class,Kuala Lumpur to Madrid via London,Family Leisure,November 2017,1.0,,"✅ Trip Verified |  Kuala Lumpur to Madrid via London. My first time flying BA and I had very low expectations. Fortunately, my experience was pleasant as the seats were generally comfortable and overall service was good. The service (KUL-LHR) was brusque. Meal was served not long after take off and my child was already sleeping as it was past midnight. I had asked if we could have it later but the reply was a curt NO and that they couldn't give it to us later nor would they have any snacks to offer. So if we got hungry we would just have to wait more than 8 hours later for the next meal. Luckily on the return route we had a very courteous cabin crew who spoke politely. Both aircrafts appeared new and the seats were wide enough for us. Some people complained about the entertainment unit under the seats. What I didn't like though is that the arm rest couldn't be kept up totally between the 2 seats so that my child could lie across his seat and mine. The armrest kind of went up to a max of 80 degree angle. The seat pockets were very small so there's very little that can kept inside. The toilets were generally clean but the toilet seat lids didn't work properly. They always fall back down and there was never seat liners. Food was below average."
Economy Class,Madrid to London Heathrow,Solo Leisure,November 2017,0.0,,❎ Not Verified |  Madrid to London Heathrow on a busy Monday evening in November was an entirely mixed affair. Boarding was from the satellite terminal which was efficient and well managed. Boarding was rather slow as too many people were allowed to bring aboard large amounts of luggage. This resulted in some bags being removed and placed into the hold. Some passengers were poorly behaved and argued with the staff. Every single seat was occupied. This was quite hard on the staff. A trendy safety instruction took place with a video of certain UK based TV personalities. This was in English only. The inflight service was very poor. I ordered a sandwich and a drink and had my receipt chucked at me. Disembarkation was slow again due to the large amount of luggage. I regard this as a health and safety matter. British Airways is not what it was and on this route there are alternatives offering better service.
Economy Class,Bologna to London Heathrow,Couple Leisure,October 2017,0.0,,❎ Not Verified |  Flew British Airways from Bologna to London Heathrow. We arrived at Bologna Airport to be told at the bag check in that the plane had been overbooked and that we would have to wait until boarding closed before we would know if there was a seat for us. We were both amazed and surprised since we had booked this return flight several weeks earlier and had arrived at the airport in good time. The member of staff dealing with us was particularly brusque and unhelpful and the only information that we were given was a typed sheet setting out the fact that if we did not travel we would be able to claim compensation. For us this was not acceptable since we had to be in the Lake District the following day. We were eventually allowed onto the plane but would not have made it if it had not been for a fellow passenger who seemed to know how to get around the queues in this situation. I thought that these problems were only found on the well known cut price airlines!
Economy Class,Baltimore to Rome via London,Couple Leisure,November 2017,0.0,,"❎ Not Verified |  My husband and I booked our honeymoon to Italy through American Airlines which unknowingly routed us to their partner airlines, British Airways. We ran immediately into trouble when we received an email notice that our flights have been changed and we now had a 40 minute layover at London Heathrow and we would not arrive in Rome in the AM as planned. We decided to give it a shot regardless. We arrived at BWI and discovered we were not on an AA flight and had packed more bags than BA would allow. (We had three checked bags instead of 2 and British Airways only allows one checked bag or you pay close to $100 for additional). Luckily the gentlemen at the counter checked the bag at no charge. I can't say the same for the rest of our trip. We found that the flight was full and they had not placed our seats together for a 6.5 hr flight and we had 2 middle seats. The neighbors on our flight refused to swap seats, originally then after some pity complaining a lovely woman swapped. We arrived into London around 9am. late of course, and after running to the next terminal in an attempt to make our connection, we missed our flight and were unable to make it through security. The BA representative told us the next flight was full and we would have to wait until 5pm. We again explained that we were on our honeymoon and had afternoon ticket reservations in Rome. The BA representative was then able to find two seats on a 12pm flight - so we missed our ticket reservations but were able to get into Rome for dinner. Upon our return flights, we attempted three times to reserve seats online via British Airways app and web (learning from before) and the website kept giving us an error screen even though the charge was pending on my PayPal account. We eventually had to make an international call and pay $174 to ensure we were able to sit next to each other on the 8 hr flight home, though we could not select seats for our connecting flight to London. Once we arrived at Rome to check - we got hit with the $100 additional baggage fee (we we tried to explain, the representative refused to comp the bag). Upon arriving at the gate my ticket was pinged for having an extra bag that was not paid for. Luckily, we had the receipt from paying 2 hrs earlier. Otherwise I imagine we would've had to shell out $100 again. We are crossing our fingers for a safe trip home, as we are again delayed on our flight from Rome to London. If you fly British Airways prepare to be nickled and dimed at every part of your journey. "
