Seat Type,Route,Type of Traveller,Date flown,Reccomend,Comfort rating,Comment
Economy Class,Heathrow to Barcelona,Couple Leisure,November 2017,0.0,,"✅ Verified Review |  Heathrow to Barcelona. Reliable. No longer feels like travelling with a premium airline. Very functional, but unfortunately at a cost. Flight took off late, because luggage for a passenger needed to be off loaded, however arrived on time in Barcelona. Excellent information from the flight deck. Cabin crew robotic and lacked personality. Enough has already been said about charges for food and drink. Overall falling well below the standards of the competition. Great pity really."
Business Class,Singapore to London,Business,October 2017,0.0,,"✅ Verified Review |  Singapore to London. My feedback seems to mirror many other users here - BA standards are just getting worse and worse, and I am talking about business class which I thought they would maintain? The cabin interior was worn and quite grubby, the seats terrible and now must be one of the poorest for long haul business class. The meal and presentation is really a joke, and on my previous long haul biz trip I got better food in Lufthansa premium economy. Cabin staff were quite friendly although they do hide in the galley a lot. Chatted to one of them who said so many customers are complaining and even deserting BA because of the fall in standards - I'm not surprised and I for one would not use them again for long haul. Time for senior management changes, as the present CEO clearly has no clue how to run what was once a premium airline. Now, they do little more than a low-cost and easyjet for one is far superior and nicer for short hops in Europe."
Business Class,London to Rome,Couple Leisure,October 2017,1.0,,"✅ Verified Review | British Airways appear to be taking positive steps to lift their game. The service on this flight was flight was materially better than that previously experienced. The quality of the food served had lifted materially. The staff were helpful. The big downside is that Club Europe sets remains stock standard economy seats - with the middle seat blocked off. The pitch is tight - too tight in my view. Another couple of centimetres would be welcome. Overall, a better BA experience."
Premium Economy,Heathrow to Dubai,Solo Leisure,September 2017,0.0,,"✅ Verified Review |  Heathrow to Dubai. This is a warning of what to expect from British Airways . If they continue to treat passengers this way I can see the airline very quickly getting into difficulty. The reply I got from the airline below just brushed all the issues I raised under the carpet. Living in Egypt for 10 years I became I frequent flyer with Egyptair. If I wanted to change the date of travel with them they only charged me £60. BA want to charge me over £500 and because I wanted to cancel my flight and go with a better airline they were only prepared to give me a £9.50 refund even though I would have given them over 2 months notice. This airline is on my black list, makes me ashamed to think this is my national airline, but never again will I book another flight with BA. There was no priority seat booking unless I paid another £38 extra. There was no priority boarding. I booked seat 23D but this was mysteriously changed at check in to 24E. BA emailed me to confirm a change in the booking but did not say what that change was. I did not make any changes. In premium economy I was wedged in like a sardine in a seat that is only 1"" wider than economy with a few inches extra leg room. Is this some kind of joke? I had to double check that I wasn't in economy as there is only one seat difference in a row. The tough chicken meal was diabolical. The cabin light over the bulkhead luggage bins was jammed on and would not go out so no sleep whatsoever. I really do not see the necessity for this light anyhow as the non smoking lights and tv screen light give emit sufficient light anyway. I ended up paying £300 extra for nothing and am extremely disappointed with this flight. A few days previously I flew premium Economy with Virgin Atlantic return from Barbados and the difference between BA and Virgin is worlds apart."
Economy Class,Tokyo Haneda to Heathrow,Solo Leisure,October 2017,0.0,,"✅ Verified Review |  Flew British Airways from Tokyo Haneda to London Heathrow. This is one of the worst flights I have ever had. The seats were so weak that I felt every movement of the passangers around me, especially the guy in front. Really old entertainment system and my friend next to me was missing the audio outlet! Food was also horrible."
Business Class,London to Toronto,Business,October 2017,0.0,,"✅ Verified Review |  London to Toronto. By now it is nothing new anymore that the CEOs very aggressive cost cutting, affected all classes including First & Business which called “Club World” does not deserve it name, because it is simply appalling! Again it is on the cost of the customer and eventually on the aircrews who have to work harder, because there are smaller teams.  It is not surprising that BA current ranking bounced back to 40th from 26th (in 2016). Fact is that this airlines which prefers rather to invest its money in flashy nonsense commercial rather than in its products does clearly not deserve to be recommended. Once a grand airline, today just another 2 star airline like there are so many."
First Class,New York JFK to London,Business,October 2017,0.0,,"✅ Verified Review |  New York to London Heathrow.  First class check in at T7 in JFK was quick, polite staff provide better service than those at Heathrow. The Concorde Room is just a few metres after security.  It is nice enough with a good range of seating and dining booths, but washroom / shower facilities are downmarket. Selected a couple of a la carte menu choices and these were nicely presented and tasty. Boarding was reasonably efficient,  and staff onboard offered usual boarding drinks, pyjamas etc. Delay of about 30 mins on departure was made up during the flight. I opted to sleep straight after take off,  seat comfort is okay if a little narrow.  90 minutes before arrival I had some fruits and pastry for breakfast,  accompanied by some good coffee. While I only needed minimal service onboard,  the staff were courteous and efficient,  and they are one of very few good things left after BA after their CEO seems to have decided to alienate loyal customers of 40 years!  Arrival into T5 at Heathrow,  B satellite at 0515 was absolute bedlam, and a reason I would choose another airline on this route. We wanted for 4 satellite trains to pass by totally full before we could even get to the main Terminal -  to find Immigration in total,  disorganised chaos. I buy and pay for my own tickets,  and do feel that BA is now grossly overpriced forge standards they provide. Please get a CEO that values quality over bean-counting."
Economy Class,Gatwick to Marrakech,Couple Leisure,October 2017,0.0,,"✅ Verified Review |  Gatwick to Marrakech, the cabin crew was lazy and rude, refusing to sell a pack of sweets which would have not taken more than 30 seconds . For the duration of half of the flight they sat in the back having a break during which all service stopped. Half way through the flight we ordered some sweets from the food menu. The lady that passed said that they will come back once they had finished serving some other customers. After 30 minutes we pressed the bell for assistance and one of the staff came to rudely explain that they hadn’t finished serving other customers even though none of the 3 staff members was seen serving anyone. We waited 20 minutes before pressing the bell again which was ignored. After another 10 Minutes my partner went to the back of the cabin to order the pack of sweets but the cabin crew explained that they are having a break now and that they stopped serving. We tried for over 1 hour to buy some Jaffa cakes which would have taken less than 30 seconds but it was too much to ask for. Ryanair or EasyJet Service is luxury compared to the service of this cabin crew. I will not use BA again if I can avoid it and cannot recommend this airline ."
Economy Class,Los Angeles to London Heathrow,Solo Leisure,July 2017,1.0,,"✅ Verified Review |  This was my first time flying with British Airways from Los Angeles to London Heathrow. I was able to secure a window seat for myself (without paying any fee) during online check-in 24 hours prior to departure. The baggage drop-off experience at LAX and LHR was smooth. At LAX, the BA staff tags your check-in bags, at LHR, you have to do it yourself. The on-board experience was good. This was my first time sitting on the upper-deck of A380 (which had a special storage bin by the window armrest). Food options were consistent with what you find on most transatlantic flights (Chicken or Pasta). There was no WiFi, but BA had a good collection of movies. I enjoyed BA's in-flight ""movie snack"" as well. The ""Flight Map / Tracker"" wasn't working on one segment, which was a bit surprising. Overall, I had a pleasant experience and would consider flying with BA again."
Economy Class,Gatwick to Cagliari,Solo Leisure,October 2017,1.0,,✅ Verified Review |  Gatwick to Cagliari proved to be a rather pleasant and well organised affair. The website was easy to use and very clear. I checked-in online and simply had to drop off my bag. I arrived very early for the flight and noted that there was quite a queue already. The boarding process was quick and efficient and the interior of the aircraft was clean. My seat was comfortable for a short flight. The captain made clear and informative announcements and the two crew I could see worked very hard and were pleasant. The crew made use of Italian and were cheerful and professional. My gripe is the awful use of Marks and Spencer food. This has to be purchased and a good few items were not available. There were no route maps and no entertainment systems. The lavatory was clean. Disembarkation was managed well.
Business Class,Shanghai to Tampa via Heathrow/Gatwick,Couple Leisure,October 2017,0.0,,"✅ Verified Review |  Shanghai to Tampa via Heathrow/Gatwick. We received deplorable customer service recently from British Airways. I purchased business class tickets on 11/28/2016 for flights on September 30, 2017. I purchased two tickets for a total of $9,676.26 plus an additional $652 for seat assignments. The problems occurred on our return flights. We were booked October 17, 2017 on BA168 Shanghai to LHR  London with continuing service, October 18, 2017 from London Gatwick)to Tampa. We were disembarking a cruise ship at the port of Shanghai on October 17, 2017. We checked in online 24 hours before our flights scheduled departure at 11:00 A.M. On the evening of October 16, 2017 the captain announced that the ship would not dock at the port as scheduled at 7:00 A.M. In the morning on October 17, the Captain announced that the Chinese had shut down the port and were not allowing any ships to dock. After these announcements we frantically tried to contact British Airways because we expected that we would miss our 11:00 AM flight. We were unable to do so. We were informed that in order to exit China without a visa, we needed to have proof of our flights leaving the country. We were aware of this requirement. We had not applied for a visa because we were only transiting from the ship to the airplane. We knew that without a visa of valid flights out, we would be escorted to the local Chinese police station until we could arrange flights out of the country. For obvious reasons we did not want to experience that situation. We were able to contact a travel agent via e-mail (our phone was not operating as we were at sea in Chin ). Our agent was able to contact British Airways and explain our situation. There was another flight that departed on October 18, which was 13 hours 40 minutes after our original flight. That was Flt BA 160. We were told here are your choices: 1. Pay a change fee of $884 and be down graded to premium economy on both flights, BA 160 and BA 2167 , even though we would be able to make BA 2167 as it did not depart London (LGW) until 11:55 AM on October 18, 2017. 2. Pay an additional $6,388 per person for a total of $12,776 to keep our business class status on both flights. (We had already paid $10,328.26 for these tickets). 3. Disembark the ship and take our chances with Chinese immigration. Option 2 was outrageous, Option 3 frightening. We felt we had no choice but to choose Option 1. The travel agent advised us to explain what had happened when we arrived at the airport at check-in and request our business class seats if they were available. When we checked in at PVG we asked if there were business class seats available. “Yes, several” was the response. We explained what had happened and asked as a courtesy if we could have those vacant seats. “Yes, for a cost of $12,776 “. Of course we refused to pay that amount. We were then charged additional baggage fees because as we had expected to be flying business class, two suitcases were over the 50 lbs limit for economy. While on board during that flight BA160, I went into the business class cabin and saw that there were indeed vacant seats. When we arrived in London we again asked to be seated in our originally purchased seats. Were we on the same flight as originally scheduled, but I was informed that our business class seats had already been assigned to other flyers. Apparently British Airways sold our seats or an upgrade to other passengers at our expense."
Economy Class,Gatwick to Marrakech,Couple Leisure,October 2017,0.0,,"✅ Verified Review |  Gatwick to Marrakech. Generally a well organised flight and fairly full in Y class. My gripe is about the current food service. This was a fairly long short-haul flight scheduled for 3h 45m in which a reasonable meal service would be welcome and desirable. After a lot of comments from others who have flown BA recently we bought food in the terminal before departure as the coho-ice on board is very limited, especially as much seems to be already 'sold out'. The biggest issue is about the time taken to do the food selling. It took almost all of the flight time for the crew to work through the plane to serve every row even though I observed that about 60% of passengers bought nothing. Of course this led to problems for those wishing to go to the toilets at the rear when food service starts at the front, any passengers from front to middle have no access to aft toilets after the trolley has passed. Passengers resorted to using the forward toilets passing through business class which I assume was not welcomed by those passengers. I overheard a crew member saying that they were not going to duty free sales as they were out of time. It is ridiculous that this paid and limited service takes so long. I remember the days when a British Midland crew could serve a full cooked breakfast with tea or coffee to all 100 or so pax on a LHR to Middlesbrough flight scheduled for 40 minutes or an Aer Lingus crew serving hot breakfast to all on a turbulent flight of 1 hr from Dublin to London. If BA want to differentiate themselves from low cost carriers then this is not the way to do it."
Business Class,Oakland to Heathrow,Solo Leisure,October 2017,1.0,,"✅ Verified Review |  Oakland to Heathrow and this flight was fine. The worst that could be said is that there is no magic, that other airlines manage to provide. Left and arrived on time. FA attentive and professional. Food reasonable and alcohol served in generous proportions. My only real complaint was the inflight entertainment was rather poor with lots of old films and TV programmes and a mediocre choice of music."
Economy Class,London to Sofia,Family Leisure,September 2017,0.0,,"✅ Verified Review |  London to Sofia. Cabin crew were kind. This is the only positive thing. British Airways are now becoming as bad as Ryanair! Onboard passengers have to pay ridiculous amount of money even for a small bottle of water. When I booked my flight from Heathrow to Sofia, I was told I get a free checked in bag for my baby girl. A day before my flight I decided to double check this and called their customer service line and the guy on the phone told me I need to pay for checked in bag if I want one. I told him that there should be one included for my baby daughter but he said this is not true. I asked him to double check this and he said he already did so I had to pay for a checked bag (£30 each way) since I already had my suitcase packed. Next day, as I went to the check in at Heathrow, I was asked how many bags do I want to check in. I asked how many bags am I allowed to check in and the lady said I can check in two bags- one for my baby and the one that I’ve paid for the previous day. The thing is that I only had one suitcase since the guy on the phone told me I can only check one bag (if I pay for it first). After I arrived in Sofia, I rang British airways and explained everything, so they agreed they should refund the money they’ve charged me for the additional bag. They said they’ll refund the £30 for the London-Sofia flight the same day and the other £30 fee for the Sofia-London route in about a week time. A month later I checked my online banking and saw they’ve only refunded £30 for the outbound journey. I rang them and they’ve said they are sorry and they’ll refund the remaining £30 within the next 3 days. When I pointed that it should be fair and reasonable that I get a 20% discount voucher from my next flight price, they said this is something British Airways do not offer. "
Economy Class,Singapore to Nassau via Heathrow,Solo Leisure,October 2017,0.0,,"✅ Verified Review |  Singapore to Nassau via Heathrow. British Airways is becoming a dismal airline to fly with. I will start with the worst and shocking aspect of my flight from Heathrow to Singapore on Oct 23. There were bugs on the flight and I have bites all over my body at least at a dozen places. One can suffer the bad food, service / behavior of cabin staff but having one's health compromised is unacceptable. The toilets were filthy. I was in the paid premium seat (front row) and I could smell the toilet from there. The attitude of staff ranges of sweet to indifferent and curt sometime for no rhyme or reason. The food is inconsistent and becomes a pain when you are on a long haul flight because there are no options available. While flying from Nassau to Heathrow, the dinner was fine but the breakfast (I think it was a morning snack), consisted of a croissant which was a cold lump, coffee which was cold and a oats snack bar. I mean, you cant get a croissant right? The inflight entertainment was mediocre at best and remains much to be desired. The screens in the Singapore- Heathrow sectors were ok to use but the Heathrow to Nassau sector were malfunctioning all the time. I could feel the fingers of the passengers sitting behind me trying to function the 'touch screen'; more like punch screen. The flights were mercifully on time and full marks for that this time. It could learn well from airlines like Singapore Airlines which are pretty consistent and clean. I am giving the airline 4 of 10 only for value for money."
Economy Class,London Heathrow to Madrid,Business,October 2017,0.0,,"✅ Verified Review |  Flew London Heathrow to Madrid. British Airways monopoly of the routes to Spain have a serious impact on the quality. BA owns Iberia so there’s no competition. Planes are the worst of the BA fleet, check-in is a nightmare because they operate each other’s flight, but the online check in does not recognize each other’s booking references. Really the worst of BA and Iberia worlds together."
Economy Class,London to Zurich,Business,October 2017,0.0,,"✅ Verified Review |  London to Zurich. A budget airline at premium prices. Lots of late and cancelled flights. Pay for luggage, food and drinks. Poor customer services even at Silver level. I have had flights cancelled in the past and after a long time on the phone offered an alternative flight from another airport. No assistance for transport."
Economy Class,Bari to Gatwick,Couple Leisure,October 2017,1.0,,"✅ Verified Review |  Bari to Gatwick. More of the same. All held together by cockpit crew. Follows my review of the outbound leg a week back. Check in excellent, not BA staff and security at Bari a breeze. Boarding well organised. Cabin crew chatting to each other as I boarded and ignored me. This is inexcusable. Flight fine, ahead of schedule and good updates from cockpit. Didn’t buy anything this time, smell of coffee far better than the taste from previous experience. Gatwick South unpleasant tho not BA’s fault. Endless staircases, broken escalator and a long walk to security where half the e-gates were out of action. Baggage hadn’t arrived anyway despite being priority so delay at security irrelevant. Had an offer to upgrade to Club for £89 - a joke as there is no lounge at Bari and the onboard value is a max of £30. I do still like flying BA as much as I don’t Easy or Ryanair. But sinking to their levels will put BA out of business for short haul. There is now little differentiator."
Economy Class,London Heathrow to Gibraltar,Couple Leisure,September 2017,1.0,,"✅ Verified Review |  Early morning 0710 flight London Heathrow to Gibraltar. Now I know that British Airways have started charging for food and drink on European flights but their service levels are dropping so low that they are now no better than Ryanair or Easyjet. It might be M&S food, but if you can't get any that does not help. We were seated at the rear of the cabin, since BA started to charge I have noticed that there is only 1 food cart which started at the front. Before there would have been 2 with 1 at the front and 1 at the rear, now by the time the cart get to you it is 1.5 hrs into the flight and they have run out of most things. This flight was early morning and they had bacon rolls on the menu which were going to be their best seller and it sells out. Pros - 23kgs cabin bag allow best in the business."
Business Class,Pisa to London,Couple Leisure,October 2017,0.0,,"✅ Verified Review |  Pisa to Gatwick. I fly this route often as I have a home in Tuscany. Believe me it does not get any better - but the option is Ryanair and that's worse. Flight started in the new South Terminal lounge. The decor and layout of the facility is great. No problems here although it's located in a ""not so easy place"" to find. Breakfast food was ghastly. Cheap baps with greasy bacon or a dried up ""eggy"" thing. Horrible. Didn't touch it and those that did - left it as confirmed by numerous plates with half eaten baps. Had tinned fruit salad and yoghurt plus a G&T. Yes I know, bit early in the day! Short walk to the gate. Plane left on time. the usual horrible 3 for 2 seats in Club Europe. The front row made it easier - but only just. Had a pleasant lunch of chicken and couscous salad. The plane was very old. This was confirmed by the WC. Originally the loo flush button was blue. After 100,000 + uses the blue was partly eroded by finger presses, to a grey colour. The loo basin cannot be described here. Plane landed on time. The Captain came out and I had a nice chat with him. Very nice bloke. Return flight started in the shared lounge. It okay but can get busy. Same plane back (recognizable by the flush button in the loo - unless all the BA319s are like it). Skipped the meal as I'd eaten lunch in Pisa. It looked nice though. A few gin and tonics to suppress my irritation at what a shoddy product Club Europe is. Great flight back into the setting sun. FAs on all flights were great. Morale very low thanks to the miserable, mean cost cutting by the BA CEO, Mr Cruz, who has no idea on how to run an airline. I first flew BA in 1980 and what a difference. Decline is sad and depressing to see as verified by 80% of reviews here be so negative. Time to find a new CEO I think."
First Class,Las Vegas to London Heathrow,Business,September 2017,0.0,,"✅ Verified Review |  Las Vegas to London Heathrow. This particular Boeing 747-400 must have been one resurrected from storage in the desert. The condition of this aircraft was appalling. The First Class cabin was literally falling apart with loose / yellowed bins, and filthy carpets. The entertainment system was old and slow, and low definition. The Premium Economy cabin was directly behind First Class, and those passengers kept using the First Class toilets. It didn't matter, because they were filthy. The dinner in First Class was inedible. British Airways are now a national embarrassment. British Airways are at best a three star airline, and maybe even a two star carrier compared to their competitors."
Economy Class,London City to Edinburgh,Family Leisure,September 2017,1.0,,"✅ Verified Review |  London City to Edinburgh. Flight left on-time and arrived early. Impressed with the legroom on the Embraer 190 (much more comfortable than BA's A320s). Check-in, security and boarding all went smoothly and quickly. Cabin crew were efficient. Light snack and drink provided on this short flight. Would fly with BA again on short sectors, and LCY is an excellent airport to use."
